<?xml version="1.0" encoding="UTF-8"?>
<!ELEMENT libreria (libro+)>
<!ELEMENT libro (titulo, autor,editorial)>

<!ELEMENT titulo (#PCDATA)>
<!ELEMENT autor (#PCDATA)>
<!ELEMENT editorial (#PCDATA)>
